{
  "version": 1,
  "statuses": [
    "open",
    "closed"
  ],
  "max_page_size": 200,
  "analysis_format": "markdown",
  "source_policy": "Council content and provenance are immutable; workflow content is separate editable analysis.",
  "hierarchy_policy": "Parents and descendants share a project. Closing closes all descendants atomically. Reopening opens ancestors. Project moves include descendants.",
  "review_policy": "Automatic reviews require every touched record version and a still-current settings gate in the write transaction. They do not authorize code execution or remediation."
}
